Key,Value,Element,Group,Description,Count
aerialway,cable_car,way,,"A cable car run. Just one or two large cars. The traction cable forms a loop, but the cars do not loop around, they just move up and down on their own side, rolling along static cables over which they are suspended.",0 41 0 0
aerialway,gondola,way,,An aerialway where the cabins go around in a circle,0 41 0 0
aerialway,mixed_lift,way,,"A mixed lift, containing both gondolas and chairs.",0 4 0 0
aerialway,chair_lift,way,,An open chairlift run. These have a single seat to sit on and are open to the outside air.,0 157 1 0
aerialway,drag_lift,way,,An overhead tow-line for skiers and riders.,2 730 17 1
aerialway,t-bar,way,,An overhead tow-line for skiers and riders with T-shaped carriers for two passengers.,0 273 1 0
aerialway,j-bar,way,,J-bar lift or L-bar lift. Overhead tow-line for skiers and riders with carriers in J-shape.,0 33 0 0
aerialway,platter,way,,An overhead tow-line for skiers and riders with platters.,0 56 0 0
aerialway,rope_tow,way,,A tow-line for skiers and riders where passenger hold by hand or use special tow grabbers.,1 157 6 0
aerialway,magic_carpet,way,,A ski lift for small children resembling a conveyor belt.,0 76 1 0
aerialway,zip_line,way,,"Zip line, gravity propelled aerial ropeslide like a flying fox or similar.",0 57 2 0
aerialway,goods,way,,"A cable supported lift for conveying goods, not passengers. Consider other values for aerialway in combination with access and usage keys instead of this.",0 104 1 0
aerialway,pylon,node,,A pylon supporting the aerialway cable.,2808 0 3 0
aerialway,station,node area,,A station where passengers and/or goods can enter and/or leave the aerialway,1225 10 220 0
aeroway,aerodrome,node area,aeroways,"An aerodrome, airport or airfield",167 2 658 0
aeroway,apron,area,aeroways,"An area of an airport where planes are parked, unloaded or loaded, refueled, or boarded",0 6 1025 0
aeroway,gate,node,aeroways,"The bounded space, inside the airport terminal, where passengers wait before boarding their flight",574 0 8 0
aeroway,hangar,area,aeroways,A large airport building with extensive floor areas for housing aircraft or spacecraft,9 0 880 0
aeroway,helipad,node area,aeroways,A landing area or platform designed for helicopters,977 0 1261 0
aeroway,heliport,node area,aeroways,A special aerodrome built for helicopters,1 0 16 0
aeroway,navigationaid,node,aeroways,A facility that supports visual navigation for aircraft,5152 20 27 0
aeroway,runway,way,aeroways,A strip of land on which aircraft can take off and land.,0 1153 169 0
aeroway,spaceport,node area,aeroways,A spaceport or cosmodrome: a site for launching or receiving spacecraft,0 0 0 0
aeroway,taxiway,way,aeroways,A route where airplanes manouevre between runways and parking areas within an aerodrome,2 6207 138 0
aeroway,terminal,node area,aeroways,An airport passenger building,30 0 221 0
aeroway,windsock,node,aeroways,An object that shows wind direction and speed.,548 1 0 0
amenity,bar,node area,restaurants,"*Bar* is a purpose-built commercial establishment that sells alcoholic drinks to be consumed on the premises. They are characterised by a noisy and vibrant atmosphere, similar to a party and usually don't sell food. See also the description of the tags amenity=pub-bar-restaurant for a distinction between these.",6519 0 597 0
amenity,biergarten,node area,restaurants,"*Biergarten* or *beer garden* is an open-air area where alcoholic beverages along with food is prepared and served. See also the description of the tags amenity=pub-bar-restaurant. A biergarten can commonly be found attached to a beer hall, pub, bar, or restaurant. In this case, you can use biergarten=yes additional to amenity=pub-bar-restaurant.",3350 2 2917 0
amenity,cafe,node area,restaurants,"*Cafe* is generally an informal place that offers casual meals and beverages- typically, the focus is on coffee or tea. Also known as a *coffeehouse/shop*, *bistro* or *sidewalk cafe*. The kind of food served may be mapped with the tags cuisine=* and diet=*. See also the tags amenity=restaurant-bar-fast_food.",26785 0 3645 0
amenity,fast_food,node area,restaurants,Fast food restaurant (see also amenity=restaurant). The kind of food served can be tagged with cuisine=* and diet=*.,29811 2 5975 0
amenity,food_court,node area,restaurants,"An area with several different restaurant food counters and a shared eating area. Commonly found in malls, airports, etc.",108 0 88 0
amenity,ice_cream,node area,restaurants,Ice cream shop or ice cream parlour. A place that sells ice cream and frozen yoghurt over the counter,3400 0 323 0
amenity,pub,node area,restaurants,A place selling beer and other alcoholic drinks- may also provide food or accommodation (UK). See description of amenity=bar and amenity=pub for distinction between bar and pub,15840 0 2744 0
amenity,restaurant,node area,restaurants,"Restaurant (not fast food, see amenity=fast_food). The kind of food served can be tagged with cuisine=* and diet=*.",77448 0 22154 0
amenity,college,node area,educational,Campus or buildings of an institute of Further Education (aka continuing education),583 0 696 0
amenity,driving_school,node area,,Driving School which offers motor vehicle driving lessons,5264 0 693 0
amenity,kindergarten,node area,educational,"For children too young for a regular school (also known as preschool, playschool or nursery school), in some countries including afternoon supervision of primary school children.",12546 2 24971 0
amenity,language_school,node area,educational,Language School: an educational institution where one studies a foreign language.,171 0 9 0
amenity,library,node area,educational,"A public library (municipal, university, ...) to borrow books from.",4092 0 1187 0
amenity,toy_library,node area,,"A place to borrow games and toys, or play with them on site.",2 0 0 0
amenity,music_school,node area,educational,"A music school, an educational institution specialized in the study, training, and research of music.",619 0 215 0
amenity,school,node area,educational,"School and grounds - primary, middle and seconday schools",7437 5 30425 0
amenity,university,node area,educational,An university campus: an institute of higher education,621 0 1517 0
amenity,kick-scooter_rental,node area,,Kick-scooter rental,0 0 0 0
amenity,bicycle_parking,node area,amenity,Parking for bicycles,68045 439 16073 1
amenity,bicycle_repair_station,node area,,"General tools for self-service bicycle repairs, usually on the roadside- no service",592 0 12 0
amenity,bicycle_rental,node area,,Rent a bicycle,3377 0 207 0
amenity,boat_rental,node area,,Rent a Boat,507 0 142 0
amenity,boat_sharing,node area,,Share a Boat,29 0 5 0
amenity,bus_station,node area,,May also be tagged as public_transport=station.,889 2 687 0
amenity,car_rental,node area,,Rent a car,1556 0 460 0
amenity,car_sharing,node area,,Share a car,2465 0 200 0
amenity,car_wash,node area,,Wash a car,3675 1 4008 0
amenity,vehicle_inspection,node area,,Government vehicle inspection,326 0 325 0
amenity,charging_station,node,,Charging facility for electric vehicles,12535 0 43 0
amenity,ferry_terminal,node area,,Ferry terminal/stop. A place where people/cars/etc. can board and leave a ferry.,1138 5 35 0
amenity,fuel,node area,,Petrol station- gas station- marine fuel- ... Streets to petrol stations are often tagged highway=service.,11542 72 6716 0
amenity,grit_bin,node,,A container that holds grit or a mixture of salt and grit.,9373 0 8 0
amenity,motorcycle_parking,node area,,Parking for motorcycles,1339 2 508 0
amenity,parking,node area,,Car park. Nodes and areas (without access tag) will get a parking symbol. Areas will be coloured. Streets on car parking are often tagged highway=service and service=parking_aisle.,57589 66 422766 2
amenity,parking_entrance,node,,An entrance or exit to an underground or multi-storey parking facility. Group multiple parking entrances together with a relation using the tags type=site and site=parking. Do *not* mix with amenity=parking.,14967 135 71 0
amenity,parking_space,node area,,A single parking space. Group multiple parking spaces together with a relation using the tags type=site and site=parking. Do *not* mix with amenity=parking.,2205 7 61897 0
amenity,taxi,node area,,A place where taxis wait for passengers.,4019 3 429 0
amenity,atm,node,,ATM or cash point: a device that provides the clients of a financial institution with access to financial transactions.,11579 1 78 0
amenity,bank,node area,,"Bank or credit union: a financial establishment where customers can deposit and withdraw money, take loans, make investments and transfer funds.",19362 0 5271 0
amenity,bureau_de_change,node,,"Bureau de change, money changer, currency exchange, Wechsel, cambio -- a place to change foreign bank notes and travellers cheques.",128 0 10 0
amenity,baby_hatch,node area,,"A place where a baby can be, out of necessity, anonymously left to be safely cared for and perhaps adopted.",67 0 1 0
amenity,clinic,node area,,A medium-sized medical facility or health centre.,504 0 667 0
amenity,dentist,node area,,A dentist practice / surgery.,10634 0 1135 0
amenity,doctors,node area,,A doctor's practice / surgery.,23766 1 2663 0
amenity,hospital,node area,medical_building,A hospital providing in-patient medical treatment. Often used in conjunction with emergency=* to note whether the medical centre has emergency facilities (A&E (brit.) or ER (am.)),435 1 2185 0
amenity,nursing_home,node area,medical_building,Discouraged tag for a home for disabled or elderly persons who need permanent care. Use amenity=social_facility + social_facility=nursing_home now.,474 0 1772 0
amenity,pharmacy,node area,,Pharmacy: a shop where a pharmacist sells medications\\,17404 0 1517 0
amenity,social_facility,node area,,"A facility that provides social services: group & nursing homes, workshops for the disabled, homeless shelters, etc.",6733 0 9813 0
amenity,veterinary,node area,,"A place where a veterinary surgeon, also known as a veterinarian or vet, practices.",3244 0 911 0
amenity,arts_centre,node area,,A venue where a variety of arts are performed or conducted,1098 0 935 0
amenity,brothel,node area,,An establishment specifically dedicated to prostitution,754 0 424 0
amenity,casino,node area,,"A gambling venue with at least one table game(e.g. roulette, blackjack) that takes bets on sporting and other events at agreed upon odds.",847 0 210 0
amenity,cinema,node area,,A place where films are shown (US: movie theater),1047 0 434 0
amenity,community_centre,node area,public_building,"A place mostly used for local events, festivities and group activities- including special interest and special age groups. .",3719 0 8171 0
amenity,conference_centre,node area,,A large building that is used to hold a convention,33 0 63 0
amenity,events_venue,node area,,A building specifically used for organising events,312 0 246 0
amenity,fountain,node area,amenity,A fountain for cultural / decorational / recreational purposes.,17000 7 2787 0
amenity,gambling,node area,,"A place for gambling, not being a shop=bookmaker, shop=lottery, amenity=casino, or leisure=adult_gaming_centre.",540 0 113 0
amenity,love_hotel,node area,,A love hotel is a type of short-stay hotel operated primarily for the purpose of allowing guests privacy for sexual activities.,5 0 3 0
amenity,nightclub,node area,,"A place to drink and dance (nightclub). The German word is ""Disco"" or ""Discothek"". Please don't confuse this with the German ""Nachtclub"" which is most likely amenity=stripclub.",1562 0 489 0
amenity,planetarium,node area,,A planetarium.,15 0 27 0
amenity,public_bookcase,node area,,A street furniture containing books. Take one or leave one.,1746 0 27 0
amenity,social_centre,node area,,A place for free and not-for-profit activities.,138 0 110 0
amenity,stripclub,node,,A place that offers striptease or lapdancing (for sexual services use /amenity=brothel)/.,68 0 12 0
amenity,studio,node area,,TV radio or recording studio,420 0 148 0
amenity,swingerclub,node area,,A club where people meet to have a party and group sex.,150 0 46 0
amenity,theatre,node area,public_building,"A theatre or opera house where live performances occur, such as plays, musicals and formal concerts. Use amenity=cinema for movie theaters.",1609 1 1168 0
amenity,courthouse,node area,public_building,"A building home to a court of law, where justice is dispensed",445 1 779 0
amenity,embassy,node area,,"An embassy, consulate or diplomatic office. Also see office=diplomatic 14px-Diplomatic",29 0 44 0
amenity,fire_station,node area,,A station of a fire brigade,9555 1 15868 0
amenity,police,node area,,A police station where police officers patrol from and that is a first point of contact for civilians,2049 2 1640 0
amenity,post_box,node,,A box for the reception of mail. Alternative mail-carriers can be tagged via operator=*,71905 0 9 0
amenity,post_depot,node area,,"Post depot or delivery office, where letters and parcels are collected and sorted prior to delivery.",27 0 355 0
amenity,post_office,node area,,Post office building with postal services,9899 0 698 0
amenity,prison,node area,,A prison or jail where people are incarcerated before trial or after conviction,35 1 289 0
amenity,ranger_station,node area,,"National Park visitor headquarters: official park visitor facility with police, visitor information, permit services, etc",5 0 16 0
amenity,townhall,node area,public_building,"Building where the administration of a village, town or city may be located, or just a community meeting place",2676 0 5305 0
amenity,bbq,node,amenity,"*BBQ* or *Barbecue* is a permanently built grill for cooking food, which is most typically used outdoors by the public. For example these may be found in city parks or at beaches. Use the tag fuel=* to specify the source of heating, such as fuel=wood-electric-charcoal. For mapping nearby table and chairs, see also the tag tourism=picnic_site. For mapping *campfires* and *firepits*, instead use the tag leisure=firepit.",3739 0 425 0
amenity,bench,node,amenity,A bench to sit down and relax a bit,459730 2237 607 1
amenity,dog_toilet,node area,,Area designated for dogs to urinate and excrete.,3 0 1 0
amenity,drinking_water,node,amenity,"*Drinking water* is a place where humans can obtain potable water for consumption. Typically, the water is used for only drinking. Also known as a *drinking fountain* or *bubbler*.",5483 0 29 0
amenity,give_box,node area,,A small facility where people drop off and pick up various types of items in the sense of free sharing and reuse.,44 0 3 0
amenity,shelter,node area,amenity,A small shelter against bad weather conditions. To additionally describe the kind of shelter use shelter_type=*.,30373 39 27120 0
amenity,shower,node area,,Public shower or bath.,1583 0 159 0
amenity,telephone,node,,Public telephone,19807 1 4 0
amenity,toilets,node area,amenity,Public toilets (might require a fee),17438 0 4534 0
amenity,water_point,node,,Place where you can get large amounts of drinking water,470 0 8 0
amenity,watering_place,node,,Place where water is contained and animals can drink,786 3 28 0
amenity,sanitary_dump_station,node area,,A place for depositing human waste from a toilet holding tank.,723 0 21 0
amenity,recycling,node area,,"Recycling facilities (bottle banks, etc.). Combine with recycling_type=container for containers or recycling_type=centre for recycling centres.",71829 1 3899 0
amenity,waste_basket,node,amenity,A single small container for depositing garbage that is easily accessible for pedestrians.,104302 6 15 0
amenity,waste_disposal,node,,"A medium or large disposal bin, typically for bagged up household or industrial waste.",3270 0 858 0
amenity,waste_transfer_station,node area,,"A waste transfer station is a location that accepts, consolidates and transfers waste in bulk.",21 0 62 0
amenity,animal_boarding,node area,,"A facility where you, paying a fee, can bring your animal for a limited period of time (e.g. for holidays)",145 0 102 0
amenity,animal_breeding,node area relation,,"A facility where animals are bred, usually to sell them",107 0 142 0
amenity,animal_shelter,node area,,A shelter that recovers animals in trouble,125 0 408 0
amenity,baking_oven,node,,"An oven used for baking bread and similar, for example inside a building=bakehouse.",34 0 31 0
amenity,childcare,node area,,A place where children of different ages are looked after which is not an amenity=kindergarten or preschool.,1018 0 1330 0
amenity,clock,node,amenity,A public visible clock,5782 1 32 0
amenity,crematorium,node area,,A place where dead human bodies are burnt,22 0 79 0
amenity,dive_centre,node area,,A dive center is the base location where sports divers usually start scuba diving or make dive guided trips at new locations.,31 0 25 0
amenity,funeral_hall,node area,amenity,"A place for holding a funeral ceremony, other than a place of worship.",1 0 147 0
amenity,grave_yard,node area,amenity,"A (smaller) place of burial, often you'll find a church nearby. Large places should be landuse=cemetery instead.",925 7 6756 0
amenity,hunting_stand,node area,amenity,A hunting stand: an open or enclosed platform used by hunters to place themselves at an elevated height above the terrain,98770 2 66 0
amenity,internet_cafe,node area,,A place whose principal role is providing internet services to the public.,198 0 8 0
amenity,kitchen,node area,,A public kitchen in a facility to use by everyone or customers,10 0 2 0
amenity,kneipp_water_cure,node area,amenity,Outdoor foot bath facility. Usually this is a pool with cold water and handrail. Popular in German speaking countries.,636 6 945 0
amenity,lounger,node,amenity,An object for people to lie down.,255 0 0 0
amenity,marketplace,way area,,A marketplace where goods and services are traded daily or weekly.,1216 4 614 0
amenity,monastery,node area,,Monastery is the location of a monastery or a building in which monks and nuns live.,33 2 254 0
amenity,photo_booth,node,,Photo Booth -- A stand to create instant photo.,299 0 6 0
amenity,place_of_mourning,node area,,"A room or building where families and friends can come, before the funeral, and view the body of the person who has died.",0 0 0 0
amenity,place_of_worship,node area,amenity,"A church, mosque, or temple, etc. Note that you also need religion=*, usually denomination=* and preferably name=* as well as amenity=place_of_worship. See the article for details.",12600 6 54876 0
amenity,public_bath,node area,,"A location where the public may bathe in common, etc. japanese onsen, turkish bath, hot spring",50 0 84 0
amenity,refugee_site,node area,,A human settlement sheltering refugees or internally displaced persons,0 0 3 0
amenity,vending_machine,node,,"A machine selling goods -- food, tickets, newspapers, etc. Add type of goods using vending=*",66598 2 97 0
amenity,user defined,node way area,,/All commonly used values/ according to Taginfo//,0 0 0 0
barrier,cable_barrier,way,,A road side or median barrier made of steel wire ropes mounted on weak posts.,9 21 0 0
barrier,city_wall,way area,,A fortification used to defend settlements in ancient to modern times.,6 3567 249 0
barrier,ditch,way,barrier,A man made ditch or trench to prevent access to the other side.,54 5442 49 0
barrier,fence,way,barrier,"A freestanding structure designed to restrict or prevent movement across a boundary, generally distinguished from a wall by the lightness of its construction.",1513 259220 34258 4
barrier,guard_rail,way,,"A rail, typically metal, designed to keep vehicles within their roadway and prevent dangerous collisions",71 11227 27 0
barrier,handrail,way,,A rail designed to be grasped by the hand so as to provide stability or support.,14 2718 7 0
barrier,hedge,way area,hedge,"A line of closely spaced shrubs and tree species, which form a barrier or mark the boundary of an area.",86 234703 5040 4
barrier,kerb,node way,,"A stone edging to a pavement or raised path (right side is bottom, left side is top).",3318 5517 1563 0
barrier,retaining_wall,way,,"A structure that holds back soil or rock from a building, structure or area.",13 27285 283 15
barrier,wall,way area,barrier,"A freestanding structure, designed to restrict or prevent movement across a boundary, typically made from solid brick, concrete or rocks, and almost always built so that it is opaque to vision.",156 126444 3440 17
barrier,block,node,,One or more large immobile block(s) usually barring free access along a way.,13445 612 29 0
barrier,bollard,node way,,One or more solid (usually concrete or metal) pillar(s) used to control traffic.,143463 2950 10 0
barrier,border_control,node,,A control point at an international border between two countries.,192 0 1 0
barrier,bump_gate,node,,A drive-through gate used in rural areas to provide a barrier to livestock that does not require the driver to exit the vehicle.,542 6 0 0
barrier,bus_trap,node,,A short section of the roadway where there is a deep dip in the middle to prevent passage by some traffic.,52 1 0 0
barrier,cattle_grid,node,,A hole in the road surface covered in a series of bars that allow wheeled vehicles but not animals to cross.,1579 10 1 0
barrier,chain,node way,,A chain used to prevent motorised vehicles.,1421 716 10 0
barrier,cycle_barrier,node,,A barrier along a path that slows or prevents access for bicycle users.,32862 60 0 0
barrier,debris,node,,Debris blocking a road,273 49 4 0
barrier,entrance,node,,An opening or gap in a barrier.,8777 84 32 0
barrier,full-height_turnstile,node way,,A full-height turnstile.,588 8 0 0
barrier,gate,node way,gate,A section in a wall or fence which can be opened to allow access.,266489 6482 40 5
barrier,hampshire_gate,node,,A section of wire fence which can be removed temporarily.,467 14 1 0
barrier,height_restrictor,node,,A height restrictor which prevents access of vehicles higher than a set limit.,404 12 0 0
barrier,horse_stile,node,,A horse stile allows pedestrians and horses to cross a gap through a fence,4 0 0 0
barrier,jersey_barrier,node way,,A barrier made of heavy prefabricated blocks.,95 585 3 0
barrier,kissing_gate,node,,A type of gate where you have to go into an enclosure and open a gate to get through.,2078 5 0 0
barrier,lift_gate,node,,A bar or pole pivoted (rotates upwards to open) in such a way as to allow the boom to block vehicular access through a controlled point.,64023 137 2 0
barrier,log,node way,,A log blocking a road.,1049 170 0 0
barrier,motorcycle_barrier,node,,A barrier along a path preventing access by motorcycles.,29 0 0 0
barrier,rope,node way,,A flexible barrier made of rope.,66 52 1 0
barrier,sally_port,node,,"A secure, controlled entryway to a fortification or prison.",728 21 27 0
barrier,spikes,node,,Spikes on the ground preventing unauthorized access.,42 1 0 0
barrier,stile,node,,"A structure which provides people a passage through or over a boundary via steps, ladders or narrow gaps.",1384 5 1 0
barrier,sump_buster,node,,A barrier to stop cars (two tracked vehicles with less than a certain ground clearance and width between tracks).,45 0 0 0
barrier,swing_gate,node,,A gate consisting of a bar or pole pivoted (rotates sidewards to open) in such a way as to allow the boom to block vehicular access through a controlled point.,6651 9 0 0
barrier,toll_booth,node area,,A place where a road usage toll or fee is collected.,193 1 8 0
barrier,turnstile,node,,"A turnstile, a passage on foot designed to allow one person at a time to pass",1552 2 0 0
barrier,yes,node way area,barrier,"Unspecific barrier value, it is always better to use more specific one if possible",2335 1642 298 2
boundary,aboriginal_lands,area,,A boundary representing official reservation boundaries of recognized aboriginal / indigenous / native peoples.,0 0 0 0
boundary,administrative,area,,"An administrative boundary. Subdivisions of areas/territories/jurisdictions recognised by governments or other organisations for administrative purposes. These range from large groups of nation states right down to small administrative districts and suburbs, as indicated by the 'admin_level=*' combo tag.",7 116084 25938 116084
boundary,hazard,area,,"A designated hazardous area, with a potential source of damage to health, life, property, or any other interest of value.",0 0 2 0
boundary,maritime,area,,"Maritime boundaries which are not administrative boundaries: the Baseline, Contiguous Zone and EEZ (Exclusive Economic Zone).",9 119 0 0
boundary,marker,node,,"A boundary marker, border marker, boundary stone, or border stone is a robust physical marker that identifies the start of a land boundary or the change in a boundary, especially a change in direction of a boundary. See also historic=boundary_stone",5100 1 1 0
boundary,national_park,area,park,"Area of outstanding natural beauty, set aside for conservation and for recreation (Other languages).",0 522 36 0
boundary,political,area,,Electoral boundaries,1 2042 687 0
boundary,postal_code,area,,Postal code boundaries,1 15225 8179 14
boundary,protected_area,area,park,"Protected areas, such as for national parks, marine protection areas, heritage sites, wilderness, cultural assets and similar.",194 6645 6614 0
boundary,special_economic_zone,area,,A government-defined area in which business and trade laws are different.,0 0 0 0
boundary,user defined,node way,,/All commonly used values according to Taginfo/,0 0 0 0
admin_level,/(number)/,area,,"Applies to boundary=administrative and is usually in the range 1 to 10, except for several countries (Bolivia, Germany, Mozambique, Netherlands, Philippines, Poland, Turkmenistan, Venezuela) where it is in the range 1 to 11 -- see boundary.",0 0 0 0
border_type,*,way area,,To distinguish between types of boundary where admin_level isn't enough. Used in several different ways e.g in maritime contexts.,0 0 0 0
start_date,/(date)/,area,,Useful if the boundary is very recent (or if it will become effective in a near future).,0 0 0 0
