Key,Value,Element,Group,Description,Count
place,square,node area,,"A town or village square: a paved open public space, generally of architectural significance, which is surrounded by buildings in a built-up area such as a city, town or village.",393 8 2646 0
place,locality,node area,,A named place that has no population.,48619 96 1752 8
place,sea,node area,,A part of an ocean.,1 0 1 0
place,ocean,node,,The world's five main major oceanic divisions.,0 0 0 0
power,cable,way,,"An insulated cable carrying electrical power, such as transmission or distribution cables located underground and undersea cables",3 4509 6 1
power,catenary_mast,node,,A pole supporting the overhead wires used to supply electricity to vehicles equipped with a pantograph such as trams and trains,10740 0 0 0
power,compensator,node,,A static power device used to ensure power quality and electrical network resilience.,33 0 12 0
power,converter,node area,,"A device to convert power between alternating and direct current electrical power: often, but not only, over high voltage networks",36 0 119 0
power,generator,node area,,"A device which converts one form of energy to another, for example, an electrical generator.",63768 8 52700 0
power,heliostat,node,,A mirror of a heliostat device,2159 0 7 0
power,insulator,node way,,An electrical insulator which connects a power line to a support structure and prevents grounding.,581 34 0 0
power,line,way,,"High-voltage power lines used for power transmission, usually supported by towers or pylons",0 29102 4 0
line,busbar,way,,"Identifies a power line as a busbar, the central connection in a substation",0 0 0 0
line,bay,way,,A power line within a substation which connects a circuit to a busbar,0 0 0 0
power,minor_line,way,,"Minor power lines forming the distribution grid, usually carried by poles.",6 60925 0 0
power,plant,area relation,,"An industrial facility where power (electricity, useful heat, biogas) is produced by individual power generator units.",13 2 2051 0
power,pole,node,,"A single pole supporting power lines, often a wood, steel or concrete mast designed to carry minor power lines.",712062 5 3 0
power,portal,node way,,"A supporting structure for power lines, composed of vertical legs with cables between them attached to a horizontal crossarm",6688 389 2 0
power,substation,node area,,"A facility which controls the flow of electricity in a power network with transformers, switchgear or compensators.",19049 5 45460 2
power,switch,node,,A device which allows electrical network operators to power up & down lines and transformers in substations or along the power grid.,3364 1 13 0
power,switchgear,area,,"A switchgear, which comprises one or more busbar assemblies and a number of bays each connecting a circuit to the busbar assembly.",85 0 274 0
power,terminal,node,,"A point of connection where an overhead power line ends on a building or wall, for example, when connecting it to an indoor substation",9543 0 22 0
power,tower,node,,A tower or pylon carrying high voltage electricity cables. Often constructed from steel latticework but tubular or solid pylons are also used.,213755 2 25 0
power,transformer,node,,A device for stepping up or down electric voltage. Large power transformers are typically located inside substations,7467 0 1095 0
public_transport,stop_position,node,,The position on the street or rails where a public transport vehicle stops.,228112 59 10 8
public_transport,platform,node way area,,The place where passengers are waiting for the public transport vehicles.,232990 50238 23572 7627
public_transport,station,node area,,A station is an area designed to access public transport.,7574 1 767 0
public_transport,stop_area,relation,,"A relation that contains all elements of a train, subway, monorail, tram, bus, trolleybus, aerialway, or ferry stop.",34 15 20 0
railway,abandoned,way,,"The course of a former railway which has been abandoned and *the track removed*. The course is still recognized through embankments, cuttings, tree rows, bridges, tunnels, remaining track ties, building shapes and rolling or straight ways. For demolished rails that are no longer identifiable, e.g. that have been built over, use railway=razed",107 42831 7 42831
railway,construction,way,,Railway under construction.,61 1104 4 1104
railway,disused,way,,A section of railway which is no longer used but where the track and infrastructure remains in place. The track is likely overgrown.,20 20965 21 20965
railway,funicular,way,,"Cable driven inclined railways on a steep slope, with a pair of cars connected by one cable",2 145 0 145
railway,light_rail,way,,"A higher-standard tram system, normally in its own right-of-way. Often it connects towns and thus reaches a considerable length (tens of kilometers).",0 8396 0 8396
railway,miniature,way,,"Miniature railways are narrower than narrow gauge and carry passengers, frequently at an exact scale of ""standard-sized"" rail (for example ""1/4 scale""). They can often be found in parks.",1 955 4 955
railway,monorail,way,,A railway with only a single rail. A monorail can run above the rail like in Las Vegas and Disneyland or can suspend below the rail like the Wuppertal Schwebebahn (Germany).,0 293 2 293
railway,narrow_gauge,way,,Narrow-gauge passenger or freight trains. Narrow gauge railways can have mainline railway service like the Rhaetian Railway in Switzerland or can be a small light industrial railway. Use gauge=* to specify the actual width of rails in mm.,0 4928 2 4928
railway,preserved,way,,"A railway running historic trains, usually a tourist attraction. Using railway:preserved=yes is an alternate method to mark railway as preserved.",0 1266 0 1266
railway,rail,way,,Full sized passenger or freight trains in the standard gauge for the country or state.,0 203331 1 203331
railway,subway,way,,A city passenger rail service running mostly grade separated (see Wikipedia:rapid transit). Often a significant portion of the line or its system/network is underground.,2 4572 0 4572
railway,tram,way,,"One or two carriage rail vehicles, usually sharing motor road, sometimes called ""street running"" (Other languages).",0 21089 9 21089
bridge,yes,way,,"If the railway goes over a street, waterway or other railway on an elevated structure.",55 318478 1320 96355
cutting,yes,way,,"A section where the railway is significantly lower than ground level, but not underground.",113 10388 54 2906
electrified,contact_line,way,,contact_line: a power line over the train head\\,0 0 0 0
embankment,yes,way,,A section where the railway is raised significantly higher than ground level,37 28709 364 12981
embedded_rails,yes/<type of railway>,way,,Specifies that a highway on which non-railway traffic is also allowed has railway tracks embedded in it but the rails are mapped as separate ways.,0 0 0 0
frequency,number [Hz],way,,The frequency with which a line is electrified. Use 0 for DC. Also see the voltage tag.,0 0 0 0
railway:track_ref,/number/,way,,Track number,0 0 0 0
service,crossover,way,,Relatively short lengths of track which switch traffic from one parallel line to another,4 9852 1 9847
service,siding,way,,"Relatively short lengths of track, running parallel to (and connected to) a main route",0 22972 10 22930
service,spur,way,,"Relatively short lengths of track, built to give one company or entity access to a main or branch line.",0 29472 3 29384
service,yard,way,,Tracks within railway company operated marshaling or maintenance yards.,3 67574 13 67246
tunnel,yes,way,,If the railway goes below ground. Most subways have this tag,133 149763 2449 9731
tracks,number,way,,"Number of parallel tracks in close proximity *when mapped as one single way representing all tracks*. If not given means /unknown/ and defaults to 1. In many parts of the world the tracks are being drawn out separately so that there is more detail, in which case this tag isn't used.",0 0 0 0
usage,main,way,,main line: heavy traffic\\,0 0 0 0
voltage,number,way,,The voltage with which a line is electrified. Also see the frequency tag.,0 0 0 0
railway,halt,node,,A small station without switches,4081 2 12 2
public_transport,stop_position,node,,The position on the railway track where the train (its center) stops at a platform. This is useful for routing on long platforms where also short trains stop and on long platforms where multiple trains stop behind each other. See also public_transport=stop_area.,228112 59 10 8
public_transport,platform,node way area,,"This is parallel to the rail line for showing where the actual platforms are. It is also to know where you can change platform and enter the station, so use footpaths to connect them. This is really useful for routing too. Use only if the platform is served by public transport.",232990 50238 23572 7627
railway,platform,way area,,"This is parallel to the rail line for showing where the actual platforms are. It is also to know where you can change platform and enter the station, so use footpaths to connect them. This is really useful for routing too. Use in addition to public_transport=platform.",183 8068 13703 8068
public_transport,station,node area,,Railway *passenger only station*.,7574 1 767 0
railway,station,node area,,Railway *passenger and/or cargo station*. Use in addition to public_transport=station.,4401 1 20 1
railway,subway_entrance,node,,"The entrance to a subway station, usually going from surface to underground.",3070 8 13 8
railway,tram_stop,node,,A tram stop is a place where a passenger can embark / disembark a tram.,9494 15 31 15
railway,buffer_stop,node,,stops the train at the end of a track. see Buffer_stop.,19395 6 0 6
railway,derail,node,,a device used to prevent fouling of a rail track by unauthorized movements of trains or unattended rolling stock. See Derail_(railroad).,1436 0 0 0
railway,crossing,node,,A point where pedestrians may cross.,29460 5 1 5
railway,level_crossing,node,,A point where rails and roads cross.,58298 9 0 9
landuse,railway,area,,Ground used around railways and railway-stations.,0 8 12288 0
railway,signal,node,,Any kind of railway signal.,97167 2 1 2
railway,switch,node,,Full connections between railways (aka 'points').,80838 1 0 1
railway,railway_crossing,node,,Crossing rails with no interconnection.,2790 0 0 0
railway,turntable,node area,,These are used for changing the direction that part of a train is pointing in.,130 263 44 263
railway,roundhouse,area,,A semicircular building with many stalls for servicing engines.,0 0 149 0
railway,traverser,node area,,These are used for changing trains between railways. Also known as transfer table.,0 54 16 54
railway,wash,node area,,A Railroad car wash,8 7 31 7
railway,user defined,node way,,/All commonly used values according to Taginfo/,0 0 0 0
route,bicycle,relation,route_bicycle,"Cycle routes or bicycles route are named, numbered or otherwise signed. May go along roads, trails or dedicated cycle paths",1 52808 0 145
route,bus,relation,,The route a public bus service takes. See Buses.,10 277703 0 1
route,canoe,relation,,Signed route for canoeing through a waterway.,0 305 0 11
route,detour,relation,,Route for fixed detour routes. Examples are Bedarfsumleitung in Germany and uitwijkroute in the Netherlands,0 8249 0 1
route,ferry,way relation,,"The route a ferry takes from terminal to terminal Please make sure to add at least one node per tile (zoom level 12), better at least one every few km, so offline editors catch it with bbox requests.",0 1357 0 4
route,foot,relation,route_foot,"Walking Route - is used for routes which are walkable without any limitations regarding fitness, equipment or weather conditions.",1 3799 0 0
route,hiking,relation,route_hiking,Hiking explains how to tag hiking routes.,2 56917 0 0
route,horse,relation,,Riding routes,0 836 0 0
route,inline_skates,relation,,Inline has more information on the subject.,0 241 0 0
route,light_rail,relation,,Route of a light rail line.,0 2380 0 0
route,mtb,relation,route_bicycle,Mountain biking explains how to tag mtb routes.,0 2734 0 1
route,piste,way relation,,"Route of a piste (e.g., snowshoe or XC-Ski trails) in a winter sport area.",1 902 14 0
route,railway,relation,,"A sequence of railway ways, often named (e.g., /Channel Tunnel/). See Railways.",1 2999 0 287
route,road,relation,,Can be used to map various road routes/long roads.,0 51339 0 124
route,running,relation,route_foot,For running (jogging) routes.,0 126 0 0
route,ski,relation,,"For ski tracks (e.g., XC-Ski Trails User:Langlufer/Loipemap).",0 1895 2 0
route,subway,relation,,Route of a metro service,0 2373 0 0
route,train,relation,,"Train services (e.g., /London-Paris Eurostar/) See Railways.",1 21578 0 76
route,tracks,relation,,Railroad track as rail infrastructure.,0 4116 0 41
route,tram,relation,,See Trams for more information on tagging tram services.,1 18630 0 2
route,trolleybus,relation,,The route of a trolleybus service.,0 329 0 0
route,/User defined/,relation,,/All commonly used values according to Taginfo/.,0 0 0 0
shop,alcohol,node area,,Shop selling alcohol to take away,1855 0 365 0
shop,bakery,node area,,Shop focused on selling bread,32828 1 3887 0
shop,beverages,node area,,Shop focused on selling alcoholic and non-alcoholic beverages. See also shop=alcohol.,5641 0 2933 0
shop,brewing_supplies,node area,,"Shop focused on selling supplies for home brewing of beer, wine and spirits (where permitted).",1 0 1 0
shop,butcher,node area,,Shop focused on selling meat,9878 0 1648 0
shop,cheese,node area,,Shop focused on selling cheese.,168 0 34 0
shop,chocolate,node area,,Shop focused on selling chocolate.,144 0 18 0
shop,coffee,node area,,Shop focused on selling coffee.,787 0 68 0
shop,confectionery,node area,,Shop focused on selling sweets or candy,984 0 95 0
shop,convenience,node area,,A small local shop carrying a small subset of the items you would find in a supermarket,7788 0 1297 0
shop,deli,node area,,"Shop focused on selling delicatessen (fine foods, gourmet foods), possibly also fine wine. Not to be confused with the US delis.",1821 0 152 0
shop,dairy,node area,,Shop focused on selling dairy products.,66 0 16 0
shop,farm,node area,,Shop or roadside stand focused on selling freshly harvested farm produce,2973 0 831 0
shop,frozen_food,node area,,Shop focused on selling frozen food.,8 0 7 0
shop,greengrocer,node area,,Shop focused on selling vegetables and fruits.,1904 0 363 0
shop,health_food,node area,,"A health food shop- selling wholefoods, vitamins, nutrition supplements and meat and dairy alternatives.",143 0 12 0
shop,ice_cream,node area,,Shop selling ice cream. See also amenity=ice_cream.,119 0 19 0
shop,+organic+,node area,,Shop focused on selling organic food. Alternatively you can use the more versatile organic=* in combination with a general shop=* key (In this case: shop=supermarket or shop=convenience).,0 0 0 0
shop,pasta,node area,,"Shop focused on selling (fresh) pasta, ravioli, etc.",7 0 0 0
shop,pastry,node area,,"Shop focused on selling baked sweets like cakes, biscuits, strudel and pies.",323 0 33 0
shop,seafood,node area,,Shop focused on selling fish/seafood.,768 0 199 0
shop,spices,node area,,Shop focused on selling spices.,46 0 5 0
shop,tea,node area,,Shop focused on selling tea.,670 0 42 0
shop,+wine+,node area,,This tag is deprecated. Please use shop=alcohol + drink:wine=yes instead,0 0 0 0
shop,water,node area,,Shop focused on selling drinking water.,1 0 0 0
shop,department_store,node area,,A single large store -- often multiple storeys high -- selling a large variety of goods (see also shop=mall),1274 0 429 0
shop,general,node area,,A store that carries a general line of merchandise. (see also shop=convenience if it sells food).,180 0 46 0
shop,kiosk,node area,,"A small shop on the pavement that sells magazines, tobacco, newspapers, sweets and stamps.",9128 0 2034 0
shop,mall,node area,,A shopping mall -- multiple stores under one roof (also known as a shopping centre),158 0 1664 0
shop,supermarket,node area,,Supermarket -- a large store with groceries and other items,17404 0 16713 0
shop,wholesale,node area,,Wholesale/warehouse club or cash and carry - a store that sells items in bulk to retailers. The branch of industry can be defined with wholesale=*.,312 0 304 0
shop,baby_goods,node area,,"Shop focused on selling objects for babies (clothes, prams, cots, toys).",256 0 60 0
shop,bag,node area,,Shop focused on selling bags.,444 0 44 0
shop,boutique,node area,,"A small shopping outlet, especially one that specializes in elite and fashionable items",1294 0 146 0
shop,clothes,node area,,Shop focused on selling clothes and/or underwear (other related value in use is /fashion/),28311 0 3261 0
shop,fabric,node area,,"Shop focused on selling fabric and other materials for the purpose of making clothes and other products, eg dress making.",1164 0 146 0
shop,+fashion+,node area,,"Shop focused on selling fashion. This is deprecated, please use clothes.",0 0 0 0
shop,fashion_accessories,node area,,Shop focused on selling fashion accessories.,106 0 11 0
shop,jewelry,node area,,Jewellers shops.,5386 0 394 0
shop,leather,node area,,Shop focused on selling products made out of leather.,241 0 15 0
shop,sewing,node area,,"A shop that sells sewing supplies (fabric, thread, yarn, knitting needles, sewing machines, etc.)",200 0 10 0
shop,shoes,node area,,Shop focused on selling shoes.,6916 0 952 0
shop,tailor,node area,,"A place where clothing is made, repaired, or altered professionally, especially suits and men's clothing",2243 0 117 0
shop,watches,node area,,Shop focused on selling watches.,266 0 31 0
shop,wool,node area,,Shop selling wool for making of clothes or other products.,115 0 6 0
shop,charity,node area,,"A charity shop is a shop operated by a charity, for the purposes of fundraising.",407 0 64 0
shop,second_hand,node area,,A shop buying and selling used clothes and other things. See also shop=pawnbroker,957 0 144 0
shop,variety_store,node area,,"A variety store retailer is a retail store that sells inexpensive items, sometimes with a single price point for all items in the store.",2370 0 570 0
shop,beauty,node area,,"A non-hairdresser beauty shop, spa, nail salon, etc.. See also shop=hairdresser.",7408 0 496 0
shop,chemist,node area,,"Shop focused on selling articles of personal hygiene, cosmetics, and household cleaning products (for a shop that potentially dispenses prescription drugs, cf. pharmacy. U.S. drug store, see amenity=pharmacy)",4436 0 1006 0
shop,cosmetics,node area,,Shop focused on selling cosmetics,1269 0 91 0
shop,+drugstore+,-,,"This tag is discouraged. Please use either shop=chemist (if they sell prescription-free drugs, cosmetics, household cleaning products, etc.) or amenity=pharmacy (if they offer prescription drugs).",0 0 0 0
shop,erotic,node area,,"Shop focused on selling erotic toys, -clothes or other erotic stuff.",361 0 62 0
shop,hairdresser,node area,,"Here you can get your hair cut, coloured, ... See also shop=beauty",28764 0 2327 0
shop,hairdresser_supply,node area,,"A shop, where you can buy hairdressing supplies.",52 0 4 0
shop,hearing_aids,node area,,Shop focused on selling hearing aids devices,2102 0 79 0
shop,herbalist,node area,,"Shop focused on selling herbs, often for medical purposes. (See also: healthcare:speciality=herbalism and healthcare=alternative).",48 0 6 0
shop,massage,node area,,A massage shop,1899 0 118 0
shop,medical_supply,node area,,Shop focused on selling medical supplies.,1894 0 200 0
shop,nutrition_supplements,node area,,"Shops that sells one or more nutritional supplements (of vitamins, minerals and/or herbs)",48 0 9 0
shop,optician,node area,,"Shop focused on selling eyeglasses, contact lenses (may also check your eyes).",6857 0 491 0
shop,perfumery,node area,,Shop focused on selling perfumery,772 0 49 0
shop,tattoo,node area,,A tattoo parlour.,1322 0 80 0
shop,agrarian,node area,,"Shop focused on selling agrarian products, like seeds, agricultural machinery, animal feed, etc.",188 0 139 0
shop,appliance,node area,,"Shop focused on selling large electrical items (aka white goods) washing machines, fridges, cookers, ovens, fans, etc.",131 0 24 0
shop,bathroom_furnishing,node area,,Shop focused on selling bathroom furniture and accessories,246 0 89 0
shop,doityourself,node area,,"Shop focused on selling tools and supplies to do-it-yourself householders, gardening, ...",2626 0 2892 0
shop,electrical,node area,,Shop focused on selling electrical supplies and devices,130 0 50 0
shop,energy,node area,,Shop focused on selling energy,31 0 5 0
shop,fireplace,node area,,"Shop focused on selling electric fireplaces, stoves or masonry heaters and required fuels",178 0 55 0
shop,florist,node area,,Shop focused on selling bouquets of flowers (see shop=garden_centre for potted flowers).,9014 0 2065 0
shop,garden_centre,node area,,"Shop focused on selling potted flowers, maybe even trees (see also shop=florist for flower bouquets).",1567 1 1666 0
shop,garden_furniture,node area,,"Shop focused on selling garden furniture (sheds, outdoor tables, gates, fences, ...). See shop=garden_centre if also plants are sold.",16 0 7 0
shop,gas,node area,,"Shop focused on selling technical gas, such as argon, oxygen, acetylene, nitrogen, carbon dioxide, etc. in pressurized containers",66 0 38 0
shop,glaziery,node area,,Shop focused on selling and installing glazing for windows and doors.,142 0 57 0
shop,groundskeeping,node area,,"Shop focused on selling outdoor groundskeeping equipment (lawnmowers, chainsaws, small tractors, ...",1 0 0 0
shop,hardware,node area,,"Shop focused on selling building supplies including screws, bolts & paints, ... See also shop=doityourself",1130 0 476 0
shop,houseware,node area,,"Shop focused on selling crockery, cutlery, kitchenware, small household appliances.",788 0 98 0
shop,locksmith,node area,,"Shop focused on selling keys, see also craft=locksmith and craft=key_cutter",430 0 75 0
shop,paint,node area,,Shop focused on selling paints.,445 0 249 0
shop,security,node area,,"Shop focused on selling security items like burglar alarms, vaults, locking systems, etc.",57 0 7 0
shop,trade,node area,,"Shop focused on selling one or more building supplies such as timber/wood, cement etc. See also shop=doityourself",658 0 737 0
shop,+windows+,node area,,This tag is deprecated. Please use craft=window_construction instead.,0 0 0 0
shop,antiques,node area,,Shop focused on selling antiques.,845 0 99 0
shop,bed,node area,,Shop focused on selling mattresses and other bedding products.,1030 0 214 0
shop,candles,node area,,"Shop focused on selling candles and candle accessories (holders, etc)",46 0 8 0
shop,carpet,node area,,Shop focused on selling carpets,300 0 94 0
shop,curtain,node area,,Shop focused on selling curtains or drapes (see also shop=fabric),327 0 83 0
shop,doors,node area,,Shop focused on selling doors,40 0 7 0
shop,flooring,node area,,Shop focused on selling floorings,42 0 21 0
shop,furniture,node area,,"Shop focused on selling furniture, might range from small decorational items to a whole flat interior",3737 0 2133 0
shop,household_linen,node area,,Shop focused on selling household linen.,3 0 2 0
shop,interior_decoration,node area,,Shop focused on selling interior decorations.,2398 0 352 0
shop,kitchen,node area,,"A shop where you can plan and buy your kitchen. (Sometimes called ""kitchen studio"" and the like, but plain kitchen is the most frequently used tag so far.)",1064 0 431 0
shop,+lamps+,node area,,Use shop=lighting instead.,0 0 0 0
shop,lighting,node area,,A shop selling lighting fixtures and lamps.,93 0 17 0
shop,tiles,node area,,Shop focused on selling tiles.,149 0 87 0
shop,window_blind,node area,,Shop focused on selling window blinds.,111 1 36 0
shop,computer,node area,,"Shop focused on selling computers, peripherals, software, ...",1922 0 314 0
shop,electronics,node area,,"Shop focused on selling consumer electronics (TV, radio, ...). Larger ones may also sell computers, fridges, ...",3859 0 1119 0
shop,hifi,node area,,Shop focused on selling High Fidelity or High End environment to listen music or watch films at home,723 0 118 0
shop,mobile_phone,node area,,Shop focused on selling mobile phones and accessories,3897 0 226 0
shop,radiotechnics,node area,,"Shop focused on selling electronic components, electrical products, radio measuring devices, supplies for radio and electronics.",132 0 28 0
shop,vacuum_cleaner,node area,,Shop focused on selling vacuum cleaners and associated products.,80 0 15 0
shop,atv,node area,,"Shop focused on selling atvs (quads), atv equipment and may rent or repair them",10 0 6 0
shop,bicycle,node area,,"Shop focused on selling bicycles, bicycle equipment and may rent or repair them",5382 0 1212 0
shop,boat,node area,,"Shop focused on selling boats, boat equipment and may rent or repair them",49 0 22 0
shop,car,node area,,Car store -- a place to buy cars or to get your car repaired,8411 0 8988 0
shop,car_repair,node area,,Shop focused on car repair (usually independent of a specific car brand).,11054 0 7920 0
shop,car_parts,node area,,"Shop focused on selling auto parts, auto accessories, motor oil, car chemicals, etc.",958 0 560 0
shop,caravan,node area,,"A shop for caravans, motorhomes & similar recreational vehicles.",47 0 55 0
shop,fuel,node area,,"Shop selling fuels (motor fuel, wood, coal, gas) that can't be considered a amenity=fuel (fuel station). Use fuel:*=yes/no to indicate which fuels are available.",12 0 20 0
shop,fishing,node area,,Shop focused on selling fishing equipment.,217 0 52 0
shop,golf,node area,,Shop focused on selling golf equipment.,6 0 1 0
shop,hunting,node area,,Shop focused on selling gun and hunting equipment.,48 0 16 0
shop,jetski,node area,,"Shop focused on selling jetskis, jetski equipment and may rent or repair them",0 0 0 0
shop,military_surplus,node area,,Shop selling used military equipment,1 0 1 0
