Key,Value,Element,Group,Description,Count
emergency,landing_site,node area,,Preselected flat area for a helicopter to land in an emergency situation,0 0 0 0
emergency,emergency_ward_entrance,node,,to mark the entrance to an emergency ward,0 0 0 0
emergency,dry_riser_inlet,node,,a point to which firefighters can connect a pressurized water source,0 0 0 0
emergency,fire_alarm_box,node,,A device used for notifying a fire department of a fire.,0 0 0 0
emergency,fire_extinguisher,node,,"A fire extinguisher is an active fire protection device used to extinguish or control small fires, often in emergency situations.",0 0 0 0
emergency,fire_hose,node,,A high-pressure hose used to carry water or other fire retardant (such as foam) to a fire to extinguish it.,0 0 0 0
emergency,fire_hydrant,node,,"An active fire protection measure, and a source of water provided in most urban, suburban, and rural areas with municipal water service to enable fire fighters to tap into the municipal water supply to assist in extinguishing a fire",0 0 0 0
emergency,water_tank,node area,,A large water basin or tank for a fire department to take water,0 0 0 0
emergency,suction_point,node,,A preferred point to pump water off a river or other waters for a fire department.,0 0 0 0
emergency,lifeguard,node area,,A place where a lifeguard is on duty,0 0 0 0
emergency,life_ring,node,,A floating ring to throw out to someone who is struggling in water.,0 0 0 0
emergency,assembly_point,node area,,A designated (safe) place where people can gather or must report to during an emergency or a fire drill,0 0 0 0
emergency,phone,node,,Emergency telephone,0 0 0 0
emergency,siren,node,,"A loud noise maker, such as an air raid siren or a tornado siren.",0 0 0 0
emergency,drinking_water,node,,A facility that provides drinking water in emergency situations,0 0 0 0
geological,moraine,node way area,,Any ice formed accumulation of unconsolidated glacial debris,0 0 0 0
geological,outcrop,node way area,,A place where the bedrock or superficial deposits previously covered under the soil have become locally exposed,0 0 0 0
geological,palaeontological_site,node area,,A palaeontological site.,0 0 0 0
geological,volcanic_caldera_rim,way,,Volcanic caldera rim,0 0 0 0
geological,volcanic_vent,node area,,Volcanic vent,0 0 0 0
geological,volcanic_lava_field,node area,,Volcanic lava field,0 0 0 0
highway,motorway,way,traffic_motorized,"A restricted access major divided highway, normally with 2 or more running lanes plus emergency hard shoulder. Equivalent to the Freeway, Autobahn, etc..",0 66054 0 66054
highway,trunk,way,traffic_motorized,The most important roads in a country's system that aren't motorways. (Need not necessarily be a divided highway.),0 31035 0 31035
highway,primary,way,traffic_motorized,The next most important roads in a country's system. (Often link larger towns.),1 203072 1 203072
highway,secondary,way,traffic_motorized,The next most important roads in a country's system. (Often link towns.),4 410182 3 410182
highway,tertiary,way,traffic_motorized,The next most important roads in a country's system. (Often link smaller towns and villages),1 372622 6 290
highway,unclassified,way,traffic_motorized,"The least important through roads in a country's system -- i.e. minor roads of a lower classification than tertiary, but which serve a purpose other than access to properties. (Often link villages and hamlets.)",4 365490 213 236
highway,residential,way,traffic_motorized,"Roads which serve as an access to housing, without function of connecting settlements. Often lined with housing.",10 1769082 1895 772
highway,motorway_link,way,traffic_motorized,The link roads (sliproads/ramps) leading to/from a motorway from/to a motorway or lower class highway. Normally with the same motorway restrictions.,0 40658 0 40658
highway,trunk_link,way,traffic_motorized,The link roads (sliproads/ramps) leading to/from a trunk road from/to a trunk road or lower class highway.,0 19799 0 19799
highway,primary_link,way,traffic_motorized,The link roads (sliproads/ramps) leading to/from a primary road from/to a primary road or lower class highway.,0 17731 0 17731
highway,secondary_link,way,traffic_motorized,The link roads (sliproads/ramps) leading to/from a secondary road from/to a secondary road or lower class highway.,0 11180 0 11180
highway,tertiary_link,way,traffic_motorized,The link roads (sliproads/ramps) leading to/from a tertiary road from/to a tertiary road or lower class highway.,0 5220 0 0
highway,living_street,way,traffic_motorized,"For living streets, which are residential streets where pedestrians have legal priority over cars, speeds are kept very low and where children are allowed to play on the street.",20 137645 562 30
highway,service,way area,traffic_motorized,"For access roads to, or within an industrial estate, camp site, business park, car park, alleys, etc. Can be used in conjunction with service=* to indicate the type of usage and with access=* to indicate who can use it and in what circumstances.",8 2777431 9010 1372
highway,pedestrian,way area,traffic_foot_cycle,For roads used mainly/exclusively for pedestrians in shopping and some residential areas which may allow access by motorised vehicles only for very limited periods of the day. To create a 'square' or 'plaza' create a closed way and tag as pedestrian and also with area=yes.,4 28739 15530 47
highway,track,way,traffic_foot_cycle,"Roads for mostly /agricultural or forestry uses/. To describe the quality of a track, see tracktype=*. Note: Although tracks are often rough with unpaved surfaces, this tag is not describing the quality of a road but its use. Consequently, if you want to tag a general use road, use one of the #Roads][general highway values instead of track.",31 2918495 935 3381
highway,bus_guideway,way,traffic_motorized,"A busway where the vehicle guided by the way (though not a railway) and is not suitable for other traffic. Please note: this is not a normal bus lane, use access=no, psv=yes instead!",0 16 0 1
highway,escape,way,traffic_motorized,"For runaway truck ramps, runaway truck lanes, emergency escape ramps, or truck arrester beds. It enables vehicles with braking failure to safely stop.",0 33 0 0
highway,raceway,way,traffic_motorized,A course or track for (motor) racing,5 1476 328 0
highway,road,way,traffic_motorized,"A road/way/street/motorway/etc. of *unknown* type. It can stand for anything ranging from a footpath to a motorway. This tag should only be used temporarily until the road/way/etc. has been properly surveyed. If you /do/ know the road type, do *not* use this value, instead use one of the more specific highway=* values.",33 1167 17 0
highway,busway,way,traffic_motorized,A dedicated roadway for bus rapid transit systems,0 0 0 0
highway,footway,way area,traffic_foot_cycle,"For designated footpaths- i.e., mainly/exclusively for pedestrians. This includes walking tracks and gravel paths. If bicycles are allowed as well, you can indicate this by adding a bicycle=yes tag. Should not be used for paths where the primary or intended usage is unknown. Use highway=pedestrian for pedestrianised roads in shopping or residential areas and highway=track if it is usable by agricultural or similar vehicles.",32 1504380 7043 783
highway,bridleway,way,traffic_foot_cycle,"For horse riders. Pedestrians are usually also permitted, cyclists may be permitted depending on local rules/laws. Motor vehicles are forbidden.",1 6891 18 5
highway,steps,way,traffic_foot_cycle,For flights of steps (stairs) on footways. Use with step_count=* to indicate the number of steps,814 217437 266 12
highway,corridor,way,,For a hallway inside of a building.,0 2575 55 0
highway,path,way,traffic_foot_cycle,"A non-specific path. Use highway=footway for paths mainly for walkers, highway=cycleway for one also usable by cyclists, highway=bridleway for ones available to horse riders as well as walkers and highway=track for ones which is passable by agriculture or similar vehicles.",42 1238706 1096 6098
footway,sidewalk,way,,Sidewalk that runs typically along residential road. Use in combination with highway=footway or highway=path,0 0 0 0
footway,crossing,way,,"Crosswalk that connects two sidewalks on the opposite side of the road. Often recognized by painted markings on the road, road sign or traffic lights. Use in combination with highway=footway or highway=path. Useful information is presence of tactile_paving=*, wheelchair=* suitability and kerb=* represented as a node on the crosswalk way.",0 0 0 0
highway,cycleway,way,traffic_foot_cycle,"For designated cycleways. Add foot=*, though it may be avoided if default-access-restrictions do apply.",0 102272 18 2497
cycleway,lane,way,,A lane is a route that lies within the roadway,0 0 0 0
cycleway,opposite,way,,Used on ways with oneway=yes where it is legally permitted to cycle in both directions. Used together with oneway:bicycle=no.,0 0 0 0
cycleway,opposite_lane,way,,"Used on ways with oneway=yes that have a cycling lane going the opposite direction of normal traffic flow (a ""contraflow"" lane). Used together with oneway:bicycle=no.",0 0 0 0
cycleway,track,way,,"A track provides a route that is separated from traffic. In the United States, this term is often used to refer to bike lanes that are separated from lanes for cars by pavement buffers, bollards, parking lanes, and curbs. /Note/ that a cycle track may alternatively be drawn as a separate way next to the road which is tagged as highway=cycleway.",0 0 0 0
cycleway,opposite_track,way,,Used on ways with oneway=yes that have a cycling track going the opposite direction of normal traffic flow. Used together with oneway:bicycle=no.,0 0 0 0
cycleway,share_busway,way,,There is a bus lane that cyclists are permitted to use.,0 0 0 0
cycleway,opposite_share_busway,way,,"Used on ways with oneway=yes that have a bus lane that cyclists are also permitted to use, and which go in the opposite direction to normal traffic flow (a ""contraflow"" bus lane). Used together with oneway:bicycle=no.",0 0 0 0
cycleway,shared_lane,way,,"Cyclists share a lane with motor vehicles, but there are markings indicating that they should share the lane with motorists. In some places these markings are known as ""sharrows"" ('sharing arrows') and this is the tag to use for those.",0 0 0 0
busway,lane,way,,Bus lane on both sides of the road. (See also: Parallel scheme for bus/psv lane tagging lanes:bus=* / lanes:psv=*),0 0 0 0
highway,proposed,way,,"For planned roads, use with proposed=* and a value of the proposed highway value.",130 7392 22 43
highway,construction,way,,For roads under construction. Use construction=* to hold the value for the completed road.,103 8217 37 23
abutters,commercial industrial  mixed,way,,See Key:abutters for more details.,0 0 0 0
bicycle_road,yes,way,,"A bicycle road is a road designated for bicycles. If residential streets get the status of bicycle roads, normally, by special signs, motor traffic is admitted with limited speed, often only for residents.",0 0 0 0
destination,<place name of destination>,way,,Destination when following a linear feature,0 0 0 0
embedded_rails,yes <type of railway>,way,,#+begin_center,0 0 0 0
ford,yes,node way,,"The road crosses through stream or river, vehicles must enter any water.",0 0 0 0
ice_road,yes,way,,"A highway is laid upon frozen water basin, definitely doesn't exist in summer.",0 0 0 0
junction,roundabout,way closedway,,"This automatically implies oneway=yes, the oneway direction is defined by the sequential ordering of nodes within the Way. This applies on a way, tagged with highway=* already.",87 26558 46 13607
lanes,<number>,way,,"The number of traffic lanes for general purpose traffic, also for buses and other specific classes of vehicle.",0 0 0 0
lit,no,node way area,,Street lighting,7833 325866 7374 124187
lit,yes,node way area,,Street lighting,19791 934288 21371 149390
maxspeed,<number>,way,,"Specifies the maximum legal speed limit on a road, railway or waterway.",0 0 0 0
motorroad,yes no,way node,,#+begin_center,0 0 0 0
mountain_pass,yes,node,,The highest point of a mountain pass.,0 0 0 0
mtb:scale,0-6,way,,Applies to highway=path and highway=track. A classification scheme for mtb trails (few inclination and downhill).,0 0 0 0
mtb:scale:uphill,0-5,way,,A classification scheme for mtb trails for going uphill if there is significant inclination.,0 0 0 0
mtb:scale:imba,0-4,way,,The IMBA Trail Difficulty Rating System shall be used for bikeparks. It is adapted to mtb trails with artificial obstacles.,0 0 0 0
mtb:description,Text,way,,Applies to highway=path and highway=track. A key to input variable infos related to mtbiking on a way with human words,0 0 0 0
overtaking,yes no caution backward,way,,Specifying sections of roads where overtaking is legally forbidden. Use overtaking:forward=yes/no/caution and overtaking:backward=yes/no/caution when it depends on driving direction.,0 0 0 0
parking:condition,free ticket disc private,way,,Specifying the parking conditions (terms). See parking:condition=* for more details.,0 0 0 0
parking:lane,parallel diagonal perpendicular no_stopping fire_lane,way,,Specifying the parking space. See parking:lane=* for more details.,0 0 0 0
passing_places,yes,way,,A way which has frequent passing places (See also: highway=passing_place),0 0 0 0
sac_scale,hiking mountain_hiking demanding_mountain_hiking difficult_alpine_hiking,way,,Applies to highway=path and highway=footway. A classification scheme for hiking trails.,0 0 0 0
smoothness,excellent good intermediate horrible very_horrible impassable,way,,See Key:smoothness for more details.,0 0 0 0
tactile_paving,yes no,node way area,,#+begin_center,0 0 0 0
tracktype,grade1 grade2 grade3,way,,To describe the quality of the surface. See Key:tracktype for more information.,0 0 0 0
traffic_calming,bump hump table yes etc.,node way,,See Key:traffic calming for more details.,0 0 0 0
trail_visibility,excellent good intermediate no,way,,"Applies to highway=path, highway=footway, highway=cycleway and highway=bridleway. A classification for hiking trails visibility",0 0 0 0
trailblazed,yes no poles,way,,Applies to highway=*. Describing trail blazing and marking. See Key:trailblazed for more information.,0 0 0 0
trailblazed:visibility,excellent good intermediate no,way,,Applies to trailblazed=*. A classification for visibility of trailblazing. See Key:trailblazed:visibility for more information.,0 0 0 0
turn,left slight_left through merge_to_left merge_to_right reverse,way,,The key turn can be used to specify the direction in which a way or a lane will lead.,0 0 0 0
width,<number>,way,,The width of a feature.,0 0 0 0
winter_road,yes,way,,"A highway functions during winter, probably can't be driven in summer.",0 0 0 0
highway,bus_stop,node,,A small bus stop. Optionally one may also use public_transport=stop_position for the position where the vehicle stops and public_transport=platform for the place where passengers wait.,330756 757 638 13
highway,crossing,node,,"A.k.a. crosswalk. Pedestrians can cross a street here- e.g., zebra crossing",210547 18 2 0
highway,elevator,node way,,"An elevator or lift, used to travel vertically, providing passenger and freight access between pathways at different floor levels.",5085 522 320 3
highway,emergency_bay,node way,,An area beside a highway where you can safely stop your car in case of breakdown or emergency.,645 40 5 0
highway,emergency_access_point,node,,Sign number which can be used to define your current position in case of an emergency. Use with ref=/NUMBER_ON_THE_SIGN/,30372 0 1 0
highway,give_way,node,,"A ""give way,"" or ""Yield"" sign",55156 1 0 0
emergency,phone,node,,A calling device can be used to tell on your current position in case of an emergency. Use with ref=/NUMBER_ON_THE_SIGN/,0 0 0 0
highway,milestone,node,,Highway location marker,9811 0 0 0
highway,mini_roundabout,node,,"Similar to roundabouts, but at the center there is either a painted circle or a fully traversable island. In case of an untraversable center island, junction=roundabout should be used.",3137 1 0 0
highway,motorway_junction,node,,"Indicates a junction (UK) or exit (US). ref=* should be set to the exit number or junction identifier. (Some roads -- e.g., the A14 -- also carry junction numbers, so the tag may be encountered elsewhere despite its name)",9245 0 0 0
highway,passing_place,node,,The location of a passing space,8618 17 10 0
highway,platform,node way area,,A platform at a bus stop or station.,3222 11461 4550 503
highway,rest_area,node area,,"Place where drivers can leave the road to rest, but not refuel.",674 1146 678 0
highway,speed_camera,node,,A fixed road-side or overhead speed camera.,4729 0 0 0
highway,street_lamp,node,,"A street light, lamppost, street lamp, light standard, or lamp standard is a raised source of light on the edge of a road, which is turned on or lit at a certain time every night",412565 3 0 0
highway,services,node area,,"A service station to get food and eat something, often found at motorways",150 336 293 0
highway,stop,node,,A stop sign,14698 0 0 0
highway,traffic_mirror,node,,Mirror that reflects the traffic on one road when direct view is blocked.,2353 0 0 0
highway,traffic_signals,node,,Lights that control the traffic,112798 3 0 0
highway,trailhead,node,,Designated place to start on a trail or route,5 0 0 0
highway,turning_circle,node,,"A turning circle is a rounded, widened area usually, but not necessarily, at the end of a road to facilitate easier turning of a vehicle. Also known as a /cul de sac/.",172156 4 3 0
highway,turning_loop,node,,"A widened area of a highway with a non-traversable island for turning around, often circular and at the end of a road.",4557 2 0 0
highway,toll_gantry,node,,"A toll gantry is a gantry suspended over a way, usually a motorway, as part of a system of electronic toll collection. For a toll booth with any kind of barrier or booth see: barrier=toll_booth",19 2 0 0
highway,User Defined,node way,,/All commonly used values/ according to Taginfo,0 0 0 0
historic,aircraft,node area,historic_site,A decommissioned aircraft which generally remains in one place.,182 0 93 0
historic,aqueduct,way area,historic_site,A historic structure to convey water,9 22 4 0
historic,archaeological_site,node way area,historic_site,A place in which evidence of past activity is preserved.,7946 161 1654 0
historic,battlefield,node area,historic_site,The site of a battle or military skirmish in the past.,138 2 31 0
historic,bomb_crater,node area,,A bomb crater,559 3 776 0
historic,boundary_stone,node,,A historic physical marker that identifies a boundary,21234 1 6 0
historic,building,node area,historic_site,Unspecified historic building.,336 1 7176 0
historic,cannon,node,,A historic/retired cannon. Usually found on forts or battlefields.,92 0 0 0
historic,castle,node area,historic_site,"Used for various kinds of castles, palaces, fortresses, manors, stately homes, kremlins, shiros and other.",1492 25 4045 0
historic,castle_wall,way area,historic_site,A fortification surrounding the bailey of a castle,2 66 11 0
historic,charcoal_pile,node area,historic_site,Historic site of a charcoal pile. Often still in good condition in hilly forest areas.,33801 1 0 0
historic,church,node area,historic_site,A church with a historical value.,55 1 457 0
historic,city_gate,node area,historic_site,A city gate within a city wall,176 14 538 0
historic,citywalls,way area,,A citywall is a fortification used to defend a city.,22 1704 307 0
historic,farm,node area,historic_site,"A historical farm, kept in its original state.",21 0 287 0
historic,fort,node area,historic_site,"A military fort, a stand-alone defensive structure which differs from a castle in that there is no permanent residence",19 3 44 0
historic,gallows,node relation,,remains of a gallows,15 0 0 0
historic,highwater_mark,node,,A marker for indicating past flood,46 0 0 0
historic,locomotive,node area,,A decommissioned locomotive which generally remains in one place,151 1 18 1
historic,manor,node area,historic_site,Historic manors/mansions having different use today,69 1 756 0
historic,memorial,node area,historic_site,"Small memorials, usually remembering special persons, people who lost their lives in the wars, past events or missing places.",54607 37 1359 2
historic,milestone,node,,A historic marker that shows the distance to important destinations,2906 0 1 0
historic,monastery,node area,,Building/place that is a historically significant monastery.,74 5 258 0
historic,monument,node area,historic_site,"A memorial object, which is especially large, built to remember, show respect to a person or group of people or to commemorate an event.",717 7 304 3
historic,optical_telegraph,node area,,Semaphore system,21 0 7 0
historic,pa,node area,,A New Zealand Maori P,0 1 0 0
historic,pillory,node,,A pillory.,31 0 1 0
historic,railway_car,node area,,A decommissioned railway car which generally remains in one place,12 0 13 0
historic,ruins,node way area,historic_site,"Remains of structures that were once complete, but have fallen into partial or complete disrepair.",2685 300 2802 2
historic,rune_stone,node,,"Stones, boulders or bedrock with historical runic inscriptions.",6 0 0 0
historic,ship,node area,,A decommissioned ship/submarine which generally remains in one place,39 0 159 0
historic,tank,node area,,A decommissioned tank which generally remains in one place,13 0 3 0
historic,tomb,node area,historic_site,A structure where somebody has been buried.,1189 4 227 0
historic,tower,node area,historic_site,This property distinguishes a tower as historic,75 0 392 0
historic,vehicle,node area,,A decommissioned vehicle which generally remains in one place,4 0 0 0
historic,wayside_cross,node,historic_site,"A historical cross, symbol of christian faith.",37602 2 29 0
historic,wayside_shrine,node area,historic_site,A shrine often showing a religious depiction. Tag is used also for modern shrines.,16163 0 427 0
historic,wreck,node area,,A nautical craft that has been sunk or destroyed.,94 0 17 0
landuse,commercial,node area,landuse_commercial,"Predominantly commercial businesses and their offices. Commercial businesses which sell goods should be categorised as landuse=retail. Commercial businesses can sell services on site and may include private Doctor's Surgeries, and those non-government services for mental and physical health, such as a Counsellor's or Physiotherapist's practice or Veterinary. Government services and businesses should not use this tag. Commercial businesses can also include office buildings and business parks which have limited interface with the public and sell their services either on site, or externally. Commercial businesses have low amounts of public foot traffic.",49 4 42591 0
landuse,construction,area,landuse_construction,"A site which is under active development and construction of a building or structure, including any purposeful alteration to the land or vegetation upon it. Abandoned construction projects and sites should not use this tag.",13 28 15766 26
landuse,education,area,,An area predominately used for educational purposes/facilities.,0 0 38 0
landuse,industrial,area,landuse_industrial,"Predominantly industrial landuses such as workshops, factories, or warehouses.",115 16 52179 0
landuse,residential,area,landuse_residential,"Land where people reside- predominantly residential detached (single houses, grouped dwellings), or attached (apartments, flats, units) dwellings. For ""Mixed-Use"" areas where more than half of the land is residential, tag as residential.\\",42 58 374429 2
landuse,retail,area,landuse_retail,"Predominantly retail businesses such as shops. Retail businesses sell physical goods such as food (prepared or grocery), clothing, medicine, stationary, appliances, tools, or other similar physical items. Retail businesses have high amounts of public foot traffic. Retail businesses do not exclusively provide or sell their services. For businesses which sell services see landuse=commercial.",44 4 12774 0
landuse,allotments,area,landuse_allotments,A piece of land given over to local residents for growing vegetables and flowers.,97 5 62244 0
landuse,farmland,area,landuse_farmland,"An area of farmland used for tillage (cereals, vegetables, oil plants, flowers).",18 99 845625 0
landuse,farmyard,area,landuse_farmyard,"An area of land with farm buildings like farmhouse, dwellings, farmsteads, sheds, stables, barns, equipment sheds, feed bunkers, etc. plus the open space in between them and the shrubbery/trees around them.",25 22 169525 0
landuse,flowerbed,area,,An area designated for flowers,18 2 1090 0
landuse,forest,area,landuse_forest,Managed forest or woodland plantation (Other languages). Some use this to map an area of trees rather than the use of the land. See Forest.,1205 115 529838 0
landuse,meadow,area,landuse_meadow,"A meadow or pasture: land primarily vegetated by grass and non-woody plants, mainly used for hay or grazing",24 85 853030 0
landuse,orchard,area,landuse_orchard,intentional planting of trees or shrubs maintained for food production,14 5 75781 0
landuse,vineyard,area,landuse_vineyard,A piece of land where grapes are grown.,8 4 29770 0
landuse,basin,area,landuse_basin,An area artificially graded to hold water.\\,82 2 28719 0
landuse,brownfield,area,landuse_brownfield,Describes land scheduled for new development where old buildings have been demolished and cleared,3 5 6218 0
landuse,cemetery,area,landuse_cemetery,Place for burials. You can add religion=* (values listed in the place of worship page). Smaller places (e.g. with a church nearby) may use amenity=grave_yard instead.,90 3 30374 0
landuse,+conservation+,area,,"Protected areas (deprecated) Alternate tagging of same thing: boundary=protected_area, protected_area=*",0 0 0 0
